{
  "schemaVersion": 1,
  "replayId": "replay_010",
  "artifactClass": "death_event_directional_discrimination_evidence",
  "sourceMethod": "replay_sourced_matched_anchor_control_directional_discrimination",
  "generatedBy": "tools/emit-death-event-directional-discrimination-evidence.mjs",
  "generatedAt": "task_186",
  "rawDataCaptured": false,
  "fieldValuesCaptured": false,
  "rawFieldNamesIncludedInRows": false,
  "rawIdsIncluded": false,
  "rawTicksIncluded": false,
  "rawTimestampsIncluded": false,
  "finalFactsProduced": false,
  "gameplayInterpretationProduced": false,
  "attributionEmitted": false,
  "anchorCount": 45,
  "matchedControlCount": 45,
  "evidenceRowCount": 45,
  "evidenceRows": [
    {
      "discriminationEvidenceKey": "directional_discrimination_000001",
      "eventCandidateKey": "death_event_candidate_000001",
      "sourceTransitionKey": "life_transition_000001",
      "participantKey": "participant_03",
      "heroRefKey": "hero_ref_05",
      "teamRefKey": "team_ref_07",
      "anchorNormalizedElapsedSecond": 86,
      "timeStratum": "quartile_1",
      "controlSelectionStatus": "selected",
      "controlNormalizedElapsedSecond": 117,
      "controlUnavailableReason": null,
      "anchorCohort": {
        "explicitDirectionalTransitions": {
          "healthBoundary": "positive_to_non_positive_boundary_candidate",
          "booleanAlive": "boolean_true_to_false_candidate",
          "respawnBoundary": "non_positive_to_positive_respawn_boundary_candidate",
          "pawnLinkPresence": "no_explicit_direction_observed"
        },
        "associationDeltaSeconds": {
          "healthBoundary": 0,
          "booleanAlive": 0,
          "respawnBoundary": 0,
          "pawnLinkPresence": null
        },
        "explicitInverseTransitions": {
          "healthBoundary": "non_positive_to_positive_boundary_candidate",
          "booleanAlive": "boolean_false_to_true_candidate",
          "respawnBoundary": "positive_to_non_positive_respawn_boundary_candidate",
          "pawnLinkPresence": "no_explicit_direction_observed"
        },
        "inverseDeltaSeconds": {
          "healthBoundary": 6,
          "booleanAlive": 8,
          "respawnBoundary": 8,
          "pawnLinkPresence": null
        },
        "nondirectionalRecurrenceObserved": {
          "healthBoundary": false,
          "booleanAlive": false,
          "lifeStateSignature": true,
          "respawnBoundary": false,
          "pawnLink": false
        },
        "distinctDirectionalFamilyCount": 3,
        "distinctInverseCycleFamilyCount": 3,
        "recurrenceFamilyCount": 1,
        "laterWindowCensoredByReplayEnd": false,
        "ambiguousAssociation": false
      },
      "controlCohort": {
        "explicitDirectionalTransitions": {
          "healthBoundary": "no_explicit_direction_observed",
          "booleanAlive": "no_explicit_direction_observed",
          "respawnBoundary": "no_explicit_direction_observed",
          "pawnLinkPresence": "no_explicit_direction_observed"
        },
        "associationDeltaSeconds": {
          "healthBoundary": null,
          "booleanAlive": null,
          "respawnBoundary": null,
          "pawnLinkPresence": null
        },
        "explicitInverseTransitions": {
          "healthBoundary": "no_explicit_direction_observed",
          "booleanAlive": "no_explicit_direction_observed",
          "respawnBoundary": "no_explicit_direction_observed",
          "pawnLinkPresence": "no_explicit_direction_observed"
        },
        "inverseDeltaSeconds": {
          "healthBoundary": null,
          "booleanAlive": null,
          "respawnBoundary": null,
          "pawnLinkPresence": null
        },
        "nondirectionalRecurrenceObserved": {
          "healthBoundary": false,
          "booleanAlive": false,
          "lifeStateSignature": false,
          "respawnBoundary": false,
          "pawnLink": false
        },
        "distinctDirectionalFamilyCount": 0,
        "distinctInverseCycleFamilyCount": 0,
        "recurrenceFamilyCount": 0,
        "laterWindowCensoredByReplayEnd": false,
        "ambiguousAssociation": false
      },
      "truthStatus": "unconfirmed_candidate",
      "finalFact": false
    },
    {
      "discriminationEvidenceKey": "directional_discrimination_000002",
      "eventCandidateKey": "death_event_candidate_000002",
      "sourceTransitionKey": "life_transition_000002",
      "participantKey": "participant_09",
      "heroRefKey": "hero_ref_02",
      "teamRefKey": "team_ref_13",
      "anchorNormalizedElapsedSecond": 140,
      "timeStratum": "quartile_1",
      "controlSelectionStatus": "selected",
      "controlNormalizedElapsedSecond": 254,
      "controlUnavailableReason": null,
      "anchorCohort": {
        "explicitDirectionalTransitions": {
          "healthBoundary": "positive_to_non_positive_boundary_candidate",
          "booleanAlive": "boolean_true_to_false_candidate",
          "respawnBoundary": "non_positive_to_positive_respawn_boundary_candidate",
          "pawnLinkPresence": "no_explicit_direction_observed"
        },
        "associationDeltaSeconds": {
          "healthBoundary": 0,
          "booleanAlive": 0,
          "respawnBoundary": 0,
          "pawnLinkPresence": null
        },
        "explicitInverseTransitions": {
          "healthBoundary": "non_positive_to_positive_boundary_candidate",
          "booleanAlive": "boolean_false_to_true_candidate",
          "respawnBoundary": "positive_to_non_positive_respawn_boundary_candidate",
          "pawnLinkPresence": "no_explicit_direction_observed"
        },
        "inverseDeltaSeconds": {
          "healthBoundary": 6,
          "booleanAlive": 8,
          "respawnBoundary": 8,
          "pawnLinkPresence": null
        },
        "nondirectionalRecurrenceObserved": {
          "healthBoundary": false,
          "booleanAlive": false,
          "lifeStateSignature": true,
          "respawnBoundary": false,
          "pawnLink": false
        },
        "distinctDirectionalFamilyCount": 3,
        "distinctInverseCycleFamilyCount": 3,
        "recurrenceFamilyCount": 1,
        "laterWindowCensoredByReplayEnd": false,
        "ambiguousAssociation": false
      },
      "controlCohort": {
        "explicitDirectionalTransitions": {
          "healthBoundary": "no_explicit_direction_observed",
          "booleanAlive": "no_explicit_direction_observed",
          "respawnBoundary": "no_explicit_direction_observed",
          "pawnLinkPresence": "no_explicit_direction_observed"
        },
        "associationDeltaSeconds": {
          "healthBoundary": null,
          "booleanAlive": null,
          "respawnBoundary": null,
          "pawnLinkPresence": null
        },
        "explicitInverseTransitions": {
          "healthBoundary": "no_explicit_direction_observed",
          "booleanAlive": "no_explicit_direction_observed",
          "respawnBoundary": "no_explicit_direction_observed",
          "pawnLinkPresence": "no_explicit_direction_observed"
        },
        "inverseDeltaSeconds": {
          "healthBoundary": null,
          "booleanAlive": null,
          "respawnBoundary": null,
          "pawnLinkPresence": null
        },
        "nondirectionalRecurrenceObserved": {
          "healthBoundary": false,
          "booleanAlive": false,
          "lifeStateSignature": false,
          "respawnBoundary": false,
          "pawnLink": false
        },
        "distinctDirectionalFamilyCount": 0,
        "distinctInverseCycleFamilyCount": 0,
        "recurrenceFamilyCount": 0,
        "laterWindowCensoredByReplayEnd": false,
        "ambiguousAssociation": false
      },
      "truthStatus": "unconfirmed_candidate",
      "finalFact": false
    },
    {
      "discriminationEvidenceKey": "directional_discrimination_000003",
      "eventCandidateKey": "death_event_candidate_000003",
      "sourceTransitionKey": "life_transition_000003",
      "participantKey": "participant_13",
      "heroRefKey": "hero_ref_04",
      "teamRefKey": "team_ref_07",
      "anchorNormalizedElapsedSecond": 243,
      "timeStratum": "quartile_1",
      "controlSelectionStatus": "selected",
      "controlNormalizedElapsedSecond": 314,
      "controlUnavailableReason": null,
      "anchorCohort": {
        "explicitDirectionalTransitions": {
          "healthBoundary": "positive_to_non_positive_boundary_candidate",
          "booleanAlive": "boolean_true_to_false_candidate",
          "respawnBoundary": "non_positive_to_positive_respawn_boundary_candidate",
          "pawnLinkPresence": "no_explicit_direction_observed"
        },
        "associationDeltaSeconds": {
          "healthBoundary": 0,
          "booleanAlive": 0,
          "respawnBoundary": 0,
          "pawnLinkPresence": null
        },
        "explicitInverseTransitions": {
          "healthBoundary": "non_positive_to_positive_boundary_candidate",
          "booleanAlive": "boolean_false_to_true_candidate",
          "respawnBoundary": "positive_to_non_positive_respawn_boundary_candidate",
          "pawnLinkPresence": "no_explicit_direction_observed"
        },
        "inverseDeltaSeconds": {
          "healthBoundary": 6,
          "booleanAlive": 8,
          "respawnBoundary": 8,
          "pawnLinkPresence": null
        },
        "nondirectionalRecurrenceObserved": {
          "healthBoundary": false,
          "booleanAlive": false,
          "lifeStateSignature": true,
          "respawnBoundary": false,
          "pawnLink": false
        },
        "distinctDirectionalFamilyCount": 3,
        "distinctInverseCycleFamilyCount": 3,
        "recurrenceFamilyCount": 1,
        "laterWindowCensoredByReplayEnd": false,
        "ambiguousAssociation": false
      },
      "controlCohort": {
        "explicitDirectionalTransitions": {
          "healthBoundary": "no_explicit_direction_observed",
          "booleanAlive": "no_explicit_direction_observed",